Nome; E-mail; Município; Bairro; Motivo da Visita; Idade
Fernando; fff; Atibaia; Alvinopolis; Assistir a um aluno especifico; 16
Henrique; ffffhhh; Atibaia; Centro; Conheci pelas Redes Sociais; 27
Luana; luuu; Atibaia; Colonial; Familiar estuda aqui; 6
Jaqueline; fjfasj; Atibaia; Imperial; Conhecer a Instituicao; 40
Larissa; llala; Piracaia; Outros; Acaso; 15
Alberto; aaaa; Atibaia; Maracana; Familiar estuda aqui; 36
Maria; mama; Atibaia; Centro; Familiar estuda aqui; 85
Wilson; wiwi; Atibaia; Outros; Familiar estuda aqui; 70
